{
 "schema_version": "NFL_EDGE_DAILY_NEWS_EDITORIAL_SUBMISSION_V1",
 "submitted_at_utc": "2026-10-31T00:14:34Z",
 "research_generated_at_utc": "2026-10-31T00:14:34Z",
 "article": {
  "schema_version": "NFL_EDGE_DAILY_NEWS_V1",
  "edition": "Evening Brief",
  "title": "NFL EDGE Friday Evening Brief",
  "dek": "Friday's final designations clear both big injury watches — Lamar Jackson and Saquon Barkley are both set to play Sunday — and the evening board makes one card change, moving Balanced to Baltimore +3.",
  "published_at_utc": "2026-10-31T00:14:34Z",
  "research_generated_at_utc": "2026-10-31T00:14:34Z",
  "sections": [
   {
    "id": "what-matters",
    "title": "What Matters Today",
    "icon": "📰",
    "items": [
     {
      "headline": "Lead: Final designations clear Jackson and Barkley for Sunday",
      "paragraphs": [
       "The wait from this morning's brief is over. Friday's final injury reports clear both of the day's big watches. Baltimore quarterback Lamar Jackson carries no game designation after three full practices this week, and head coach Jesse Minter confirmed Friday that Jackson will play Sunday at Buffalo — his first game since the high-ankle sprain on October 4 cost him three games. Philadelphia running back Saquon Barkley is also clear: limited in Friday's practice after missing Wednesday and Thursday with hamstring and back injuries, he carries no game designation for Sunday night at Washington.",
       "The app has caught up on the quarterback side. It lists Jackson as Baltimore's expected starter for Sunday's 1:00 p.m. ET kickoff at Buffalo, and Tanner McKee as Philadelphia's expected starter for Sunday night. That matches the final reports — no mismatch to flag."
      ],
      "takeaway": "Jackson and Barkley are both cleared — the two prices this morning said to wait on are now decided.",
      "evidence_ids": [
       "ev-jackson-fri",
       "ev-barkley-fri",
       "ev-cards-pm"
      ],
      "sources": [
       {
        "label": "Ravens Wire",
        "url": "https://ravenswire.usatoday.com/story/sports/nfl/ravens/2026/10/30/ravens-bills-week-8-final-injury-report-vega-ioane-lamar-jackson/92519739007/"
       },
       {
        "label": "Eagles Wire",
        "url": "https://theeagleswire.usatoday.com/story/sports/nfl/eagles/2026/10/30/eagles-commanders-week-8-final-injury-report-barkley-devonta-smith/92520512007/"
       }
      ]
     },
     {
      "headline": "Injury roundup: the outs around those two returns",
      "paragraphs": [
       "Baltimore will be without starting right guard Vega Ioane (knee) and safety Jaylinn Hawkins (knee) on Sunday. On the Buffalo side, wide receiver DJ Moore and tight end Dalton Kincaid are questionable, among six Bills listed questionable.",
       "Philadelphia ruled out five players: wide receivers DeVonta Smith (hamstring) and Dontayvion Wicks (ankle), linebacker Jihaad Campbell (hamstring/quad), wide receiver Britain Covey (knee), and cornerback Jonathan Jones (hamstring). Cornerback Jakorian Bennett is questionable with a knee injury.",
       "Washington ruled out starting defensive lineman Javon Kinlaw. Defensive lineman Daron Payne (foot), tight end John Bates, wide receiver Treylon Burks, and defensive lineman Jer'Zhan Newton are questionable.",
       "One thing that is not a watch: Philadelphia's quarterback. Jalen Hurts is on injured reserve and out for the season, and McKee makes his third straight start Sunday night."
      ],
      "takeaway": "The returns are the headline; the outs are mostly depth and receiver room — check the inactive lists about 90 minutes before kickoff for the questionable names.",
      "evidence_ids": [
       "ev-jackson-fri",
       "ev-barkley-fri",
       "ev-commanders-fri"
      ],
      "sources": [
       {
        "label": "Buffalo Rumblings",
        "url": "https://www.buffalorumblings.com/buffalo-bills-injuries/144001/bills-injury-report-week-8-verdict-on-lamar-jackson-questionable-status-for-key-buffalo-pass-game-weapons"
       },
       {
        "label": "Eagles Wire",
        "url": "https://theeagleswire.usatoday.com/story/sports/nfl/eagles/2026/10/30/eagles-commanders-week-8-final-injury-report-barkley-devonta-smith/92520512007/"
       },
       {
        "label": "Sports Illustrated",
        "url": "https://www.si.com/nfl/commanders/onsi/commanders-eagles-final-injury-report-defensive-line"
       }
      ]
     },
     {
      "headline": "Weather: no games Saturday, so Sunday's outdoor slate waits for Sunday morning",
      "paragraphs": [
       "There are no NFL games on Saturday, so there is no kickoff-window forecast to report tonight. The next weather that matters is Sunday's outdoor slate — Baltimore at Buffalo, Kansas City at Denver, Minnesota at Detroit, Atlanta at Tampa Bay and the rest of the 1 p.m. ET games — and the final kickoff-window forecasts for those games belong in Sunday morning's brief, when they are close enough to trust.",
       "That is a schedule fact, not a totals edge. Nothing here argues any total either way."
      ],
      "takeaway": "No games Saturday; Sunday's outdoor games get their final weather check Sunday morning.",
      "evidence_ids": [
       "ev-cards-pm"
      ],
      "sources": []
     }
    ]
   },
   {
    "id": "what-it-means",
    "title": "What It Means for NFL EDGE",
    "icon": "💡",
    "items": [
     {
      "headline": "Evening cards: Balanced moves to Baltimore +3; Hit Rate and Value hold",
      "paragraphs": [
       "Hit Rate is the Los Angeles Rams moneyline -270 at DraftKings, for Sunday, 4:05 p.m. ET (Los Angeles Chargers at Los Angeles Rams). Hit Rate is the pick that looks most likely to win. It forgoes value for win probability, and the app's own tutorial says Hit Rate is not Profit Rate. The app puts the Rams at 64.9 percent, with LOW reliability, and the app's expected margin for the game is 2.41 against a market line of Rams -6.5. The play-through price on the card is -275. The app lists Justin Herbert as the Chargers' expected starter and Matthew Stafford for the Rams.",
       "Balanced is Baltimore +3 at -104 at FanDuel, for Sunday, 1:00 p.m. ET (Baltimore at Buffalo). Balanced is a strong pick without paying too much, a good starting point for a new bettor. The app puts Baltimore at 50.5 percent, with MEDIUM reliability, and the app's expected margin for the game is 1.15 against a market line of Baltimore +3. The play-through price on the card is -107. The app lists Lamar Jackson as Baltimore's expected starter and Josh Allen for Buffalo.",
       "Value is Chicago +3 at -105 at DraftKings, for Monday, 8:15 p.m. ET (Chicago at Seattle). Value is always the app's +EV play. The app puts Chicago at 50.6 percent, with MEDIUM reliability, and the play-through price is -108. The app lists Caleb Williams as Chicago's expected starter. Balanced and Value no longer agree — they are now two different games, not the same pick twice."
      ],
      "takeaway": "Hit Rate: Rams moneyline -270. Balanced: Baltimore +3 -104 at FanDuel. Value: Chicago +3 -105 at DraftKings.",
      "evidence_ids": [
       "ev-cards-pm"
      ],
      "sources": []
     },
     {
      "headline": "A changed card still means checking your own price",
      "paragraphs": [
       "The board refreshes every morning and evening, and tonight's board proves why that matters: Balanced changed today. When the board has not picked up a move, or your book is not DraftKings or FanDuel, tap Check, type in your book's line and price, and the app runs it back through the model and evaluator and returns a bet/no-bet verdict on your price. Full re-evaluation, not a blind override.",
       "And remember what a price means: -270 means every $2.70 you risk wins $1, -104 means every $1.04 you risk wins $1, and -105 means every $1.05 you risk wins $1. The app sets your actual stake from your bankroll and staking choice."
      ],
      "takeaway": "Balanced changed tonight: run your own book's line through Check and let that verdict decide.",
      "evidence_ids": [
       "ev-cards-pm"
      ],
      "sources": []
     }
    ]
   },
   {
    "id": "fade",
    "title": "Learn the Game",
    "icon": "⚖️",
    "mode": "learning",
    "items": [
     {
      "headline": "Learn the Game: what a key number is",
      "paragraphs": [
       "(Hypothetical example:) Imagine your team is favored by 2.5 points, and wins by exactly 3. You win. If the line had been 3.5, that same 3-point win would lose. That is why 3 is called a key number — it is one of the most common margins of victory in football, along with 7.",
       "A line moving from -2.5 to -3.5 crosses a key number, and that is a bigger deal than a move from -4 to -4.5, which crosses no common margin. Books know this, which is why moving across 3 or 7 usually costs more in price.",
       "How to apply it: when you compare your book's line to the app's line, check whether a key number sits between them. If the app's number is +3 and your book offers +3.5, that is a genuinely better bet, not the same bet — and if your book offers +2.5 where the app has +3, run your line through Check, because the verdict is on your price, key number and all."
      ],
      "takeaway": "Key numbers are 3 and 7 — the most common winning margins — so a line crossing one matters more than a line moving anywhere else.",
      "evidence_ids": [],
      "sources": [],
      "editorial_only": true
     }
    ]
   },
   {
    "id": "market-watch",
    "title": "Line Movement",
    "icon": "👀",
    "items": [
     {
      "headline": "Evening board vs morning board: Balanced changes, the rest tick",
      "paragraphs": [